{
  "schema_version": "1.0.0",
  "task_id": "6f6b2f6e-6b7c-4f6d-9c1e-2f3a4b5c6d7e",
  "event_id": "0d1e2f3a-4b5c-6d7e-8f90-1a2b3c4d5e6f",
  "completed_at": "2026-09-18T10:00:05Z",
  "started_at": "2026-09-18T10:00:00Z",
  "run_id": "1a2b3c4d-5e6f-7a8b-9c0d-1e2f3a4b5c6d",
  "task_type": "bounded-code-transformation",
  "status": "succeeded",
  "success": true,
  "tests_passed": true,
  "escalated": true,
  "escalation_count": 1,
  "attempt_count": 2,
  "initial_provider": "ollama",
  "initial_model": "qwen3.6:27b-coding",
  "initial_variant": "low",
  "final_provider": "deepseek",
  "final_model": "deepseek-flash",
  "final_variant": "high",
  "total_latency_ms": 18400.0,
  "provider_reported_cost": null,
  "estimated_total_cost": 0.0231,
  "pricing_currency": "USD",
  "error_category": null,
  "error_code": null
}
